id	section	stakeholder	question	answerable_now	dashboard_location	metric_used	time_window	how_derived	owner	gap_note
G8	G Comparative	Comparative DePIN analysts / community	Is Onocoy’s capped-supply profile trading flexibility for anti-dilution resilience?	P	D06,D07,D15	supply trajectory; inflation; solvency; payback	Scenario horizon	Compare supply/inflation path against resilience metrics	Benchmarking Lead	No explicit tradeoff frontier visualization
H1	H Token	Token holders / treasury-risk readers	Is net emission pressure increasing or decreasing?	Y	D03,D11,D17	minted; burned; inflation; netFlow	Weekly trend	Track burn-mint and inflation trajectory	Treasury/Risk	None
H2	H Token	Token holders / treasury-risk readers	Is burn-to-mint trending toward or away from solvency?	Y	D03,D11	solvencyScore trend	Weekly trend	Read solvency curve slope and threshold relation	Treasury/Risk	None
H3	H Token	Token holders / treasury-risk readers	How severe is unlock-event downside under current liquidity depth?	Y	D02,D03,D14,D15	initialLiquidity; investorSellPct; drawdown; tailRisk	Unlock event window	Run liquidity shock and inspect drawdown/tail risk	Treasury/Risk	Severity is scenario-based unless real vesting integers are supplied
H4	H Token	Token holders / treasury-risk readers	How much of provider retention is subsidy-supported vs economically viable?	P	D11,D12	underwaterCount; cost/revenue per capacity; payback	Current + trend	Estimate subsidy dependence from profitability gap metrics	Treasury/Risk	No explicit decomposition percentage
H5	H Token	Token holders / treasury-risk readers	Are price shocks likely to trigger second-order infrastructure attrition?	P	D03,D12,D15	price shock; panic churn; providers/capacity decline	Post-shock window	Observe sequential price->churn->capacity effects	Treasury/Risk	No explicit probability estimator for second-order attrition
H6	H Token	Token holders / treasury-risk readers	Which treasury/risk buffers are needed to absorb market dislocation?	P	D11,D14	treasury runway; tail risk; insolvency exposure	Scenario horizon	Use financial and risk branches to size needed buffers manually	Treasury/Risk	No optimizer for required buffer sizing
H7	H Token	Token holders / treasury-risk readers	Are we diluting to preserve short-term participation?	P	D03,D11	supply growth; mint vs burn; retention/providercount	Current + trend	Cross-check inflation pressure vs participation support	Treasury/Risk	No explicit dilution-attribution model
H8	H Token	Token holders / treasury-risk readers	Are interventions improving long-run solvency or postponing adjustment?	P	D07,D11,D14	long-horizon solvency projection; tail risk post intervention	Multi-scenario intervention runs	Compare intervention vs baseline trajectories	Treasury/Risk	No automated postpone-vs-improve classifier
H9	H Token	Token holders / treasury-risk readers	How exposed is network health to token volatility?	Y	D14,D12	volatility; drawdown; insolvencyRate; churn	Scenario horizon	Use risk branch volatility/tail metrics and miner stress response	Treasury/Risk	None
H10	H Token	Token holders / treasury-risk readers	Are we approaching conditions consistent with death-spiral probability alerts?	P	D14,D17,D06	tailRiskScore; insolvencyRate; drawdown; deathSpiralRisk	Current + near-term	Use tail-risk and drawdown alerts as probability proxies	Treasury/Risk	No direct deathSpiralProbability alert card
